<?xml version="1.0" encoding="UTF-8"?>
<xs:schema xmlns:xs="http://www.w3.org/2001/XMLSchema" elementFormDefault="qualified" attributeFormDefault="unqualified">
	<xs:element name="FIX_REPOSITORY_METADATA">
		<xs:annotation>
			<xs:documentation>Comment describing your root element</xs:documentation>
		</xs:annotation>
		<xs:complexType>
			<xs:sequence>
				<xs:element name="ELEMENTS">
					<xs:complexType>
						<xs:sequence maxOccurs="unbounded">
							<xs:element name="ELEMENT">
								<xs:complexType>
									<xs:attribute name="name"/>
									<xs:attribute name="pk_name"/>
								</xs:complexType>
							</xs:element>
						</xs:sequence>
					</xs:complexType>
				</xs:element>
			</xs:sequence>
		</xs:complexType>
	</xs:element>
</xs:schema>
